{
  "schema_version": "1.0",
  "project_id": "clr-2026-large-print-sudoku-for-seniors-easy-puzzles-with",
  "current_state": "RELEASE_AUTHORIZATION",
  "previous_state": "PLATFORM_PACKAGING",
  "revision_cycle": 0,
  "targeted_repairs": {},
  "active_artifacts": {
    "intake-note": "sha256:ddb37f896336cbc0492d0ddc33f4189cd86ec50dc9275a16eedebd8d14f11513",
    "product-brief": "sha256:ac56faf8eed41711e071c40eb5a5d681f882fd3f9afc67c9a8dbfb82fbe57a25",
    "niche-assessment": "sha256:8aeac258334e357344ba0aa936f96f1f0156d190a20ea7377e53d0f8fc855f5c",
    "content-plan": "sha256:f729a19991b367ca26b2ed137f5e46da9d35739d7dc215bc67accfb7a547759c",
    "project-spec": "sha256:306e75023e518222cd386739af4f1b2b6f21a650017e04f42e7399b546563bb1",
    "content-sudoku": "sha256:69175ea7b7f22edc3cacb443ac17b9e599ea3831285d8f61a6e5b6edc54bdaf7",
    "content-verification": "sha256:29bc4463444f121e52c4fb1c5072567252975f9354b804ce8c4ceaeb7a0a928e",
    "interior-pdf": "sha256:b5e76422633756f5505c5186f3a96e257699319ba40160d1314902b77d99b0ae",
    "interior-proof": "sha256:b049dc23dc8470bc6e4de0a8e6050759db79963b0947f309da55a8cef463d19f",
    "quality-review": "sha256:944eccade8a3139c433b0752beebd7b9f2b1370df4339cc09cfd7d6d3d81ff87",
    "quality-gate": "sha256:72eb2bb696f6385c341126b7de882f6a1fd04af8e7f3987e588dfb263b130318",
    "cover-art-direction": "sha256:412608ca1b24d68647cb6eec3a5da3bea53aa3140e37d544b5ecd2805e444f0f",
    "cover-pdf": "sha256:3a6f2d7df1624a0bf0c0dab4243bdebe0b4c2d4edd30f6f2e02d7a8c5c55ec98",
    "cover-proof": "sha256:a63f92629754d5b23c270813425929962a6556cfc8401b34ba8c6826b66690b8",
    "accessibility-gate": "sha256:4ece5668b5fbf17773998778c337df4fb424d270b99ada7c8ca1550d9ef692b0",
    "rights-ledger": "sha256:d73af64fc9bf4eb996fc876c5f92a303391821dbdc3e9cc727f3562c77381e90",
    "rights-gate": "sha256:da3a6b7093b9ed1f12e38f7d9551a1d537d1c5bece631e1c19d3cebe2a2a7230",
    "metadata": "sha256:5b0cdfdf87454d1f0fbd5a24f75d2529c33f627709801e8a234f1545b591fec7",
    "metadata-validation": "sha256:7e8641cd83d8b1d9a2f44a840a52bff3d41a121ac88e3a6827febe6469af8bde",
    "listing-kit": "sha256:9f4218d3da7dc09583b9e9f076ccb45efbfd1eb16581c7dc288b4e5532be7ae0",
    "launch-guide": "sha256:378caf1d70eb12ee6698efce9e21a8423b1e1cf965a71436fa5c213d81b45c89",
    "platform-package-kdp": "sha256:577670bf1c3bd52e75272dd70a756fbb773c18465275f87dbb30e918d35f2ef9",
    "platform-package-etsy": "sha256:b4fc4307a015498307778a0f0fc07b8ffdeddb6f876c5a157752bf34890293e6",
    "illustration": "sha256:724b96a1e003814d30abda995a2a3a796a5d0fae718ea8795945a3ae733299ad"
  },
  "required_reviews": [],
  "completed_reviews": [],
  "blocked_reasons": [],
  "quality_gate": {
    "decision": "PASS",
    "evaluated_at": "2026-07-31T13:05:12Z",
    "counts": {
      "blocker": 0,
      "major": 0,
      "minor": 0,
      "note": 1
    },
    "weighted_overall": 4.75
  },
  "rights_gate": {
    "decision": "PASS",
    "evaluated_at": "2026-07-31T13:28:50Z",
    "unlinked": 0,
    "blocked": 0
  },
  "invalidated_approvals": [
    "apr-interior-20260731t130811z-15865981",
    "apr-cover-20260731t131846z-4844a6de",
    "apr-compliance-20260731t133613z-47cb93c4"
  ],
  "updated_at": "2026-08-16T14:20:23Z",
  "updated_by": "prepress-specialist",
  "niche_assessment": {
    "decision": "PASS",
    "opportunity_score": 0.4,
    "evaluated_at": "2026-07-31T12:45:33Z"
  },
  "content_verification": {
    "decision": "PASS",
    "evaluated_at": "2026-08-14T06:54:05Z",
    "item_count": 100,
    "failed_batches": 0
  },
  "accessibility_gate": {
    "decision": "PASS",
    "evaluated_at": "2026-07-31T13:26:00Z",
    "issues": 0
  }
}
